{
  "job_id": "20261022-demo-drill",
  "reviewer": "demo-verifier",
  "artifact_path": "jobs/20261022-demo-drill/drafts/v1.md",
  "artifact_version": "v1",
  "verdict": "pass",
  "rules_checked": ["DM01", "DM02", "DM03", "DM04"],
  "findings": [],
  "summary": "Stand-in verifier (live drill): no factual claims needing sources."
}
